text,sentiment
"@Graffitera23 qué hermoso!,es bueno desviar la mirada al cielo y a las nubes de vez en cuando,abajo está jodido.preciosa foto,mil abrazos ",P
Un saludo a mi crush del segundo semestre del 2016! Ya casi se acaba el año y dejará de ser mi crush y nada de que me dio pelota,N
"@guuatever @LeidiPonzonia @soychicabrit Fue el primer show de mi vida, tenía 14/15.",NEU
"Con todas las minas hermosas que hay, oportunidades cero",N
@RaulVCF__ ya y asi se va a quedar hasta que encuentre una de villa nueva en calidad ,N
"me gustaría volver a sentir q tu me miras, sentirse la única persona en tu vida, rozar tu cuerpo sin preocupación alguna y ver como me",P
@ron_quintanilla @belecastillo jajajaja cuando? Estoy súper full,NEU
Hay una gran parten de odio en mi,N
Estoy malito No quiero salir de mi camita.,N
"@Gloryagpem @karench0708 ayer andábamos por allá jaja, le diré que vayamos mañana a ver si me dejan gracias lindas",P
"@MonumentalCR buenos días, último día laboral, me voy a vacaciones una semana. Éxitos en sus vidas y que sean muy felices",P
@ViajerosAccion Jajajaja buena buena foto,P
"@Moguei @Begomix no tiene bastante con tener DOS puntos de salud, además está enamoradísima de la princesa y la princesa de la mala ",N
@tresciente a mí también; no lo he probado como para opinar,NEU
@Martiiibelieber hahaha se te extraña sucia,P
"Trataré de ser positiva este último mes, para que no me vaya tan mal como todo el maldito año",NEU
"#MisPropositosPara2017Son buscar un mejor amigo, necesito a alguien!? nadie?",N
@AlfonsoEmilioL La próxima vez que no vea lo entrevisto y pregunto que escucha.,NEU
"Me gustaría pensar que me están haciendo un bluffing, de esos que yo haría. Pero algo me dice que no es así",NEU
es bien raro no estar en la escuela a esta hora :c la neta sí extraño eso y apenas van dos días de clases jajajaja,N
"@cenizaplay Va perfecto entonces, ¡muchas gracias! ",P
"Cuando no sepas que hacer nada mas hagarra tu celular, unos audifonos y despeja tu mente!",P
"Toca ir a trabajar así me duela el tobillo, necesito el dinero ya que ahora es mi único ingreso.",NEU
Vine en bici a un curso de mi chamba en San Isidro. Genial...!! Solo mi pelo ha sufrido estragos. Pensare en algo para q mañana no suceda,NEU
El sueño mas hermoso que he tenido. #nomequeriadespertar,P
"Hoy a las 17hs en la 3F, cara a cara con generadores SD. Mañana a las 9hs en el 6° piso, coaching de apps SD. Los esperamos #GX26",NEU
@cherolero @DomesticoMX hola. Cuesta 80 y no importa la hora que llegues. Pero aprovecha por lo menos una horita,P
"Me siento tan inútil, pero bueno yo siempre he trabajo en las tareas pasadas",N
A estas horas la Av Javier prado libre #salgantodos,P
"@mariobautista_ Soy mala Bautister, no puse el 11:14",N
"Es worth para coger el bonus, pero es mucho más divertido luchar ",NEU
@PortalSB_UDLog @CDLaredo @CyDLeonesa estos por lo menos han visto 4 goles ,NEU
Entró a trabajar a la 1:30 p.m y yo en San Carlos Mi tío cree que voy a llegar puntual.,NEU
Hize mal en bañarme tarde.... #VideoMTV2016 @AbrahamMateoMus pero asi enfermita y todo siempre apoyandotee¡¡¡ *emoji enamorado* jiji,NEU
"@MauFonseca11 @PilarAcuna O regalar bombitas y escopetas para que cada ""american"" se defienda. Lindo",NEU
pasando un tarde hermosa en mercedes mirando la ciudad desde lo mas alto,P
"@SirRhosisRGL eso sí, hay raza que de verdad está súper jodida",N
@RufinaCamejo @mister__lemon @diego_vallarino Wrong. Desde 2005 hasta exactamente la primera vez en que pierda el FA,NEU
Un nuevo ciclo y con muchas cosas por realizar,NEU
@mczorro @Carlos_Chavez Ya sabes cómo me siento cuando tengo que cruzar media ciudad para ver una película,N
"Hoy es feriado y el trafico será menos, igual o mayor en Lima, allá vamos con Fe",NEU
#FelizMiercoles Mis Pequeños Amores Dios me los bendiga a todos y espero que todos sus sueños se hagan realidad,P
"@Carles_Garsia si y si no esta en el cajón de ropa que tengo que devolver, que como ha hecho mil de calor ya no me he apropiado de el:'(",N
@DianiDeMG ¡Qué bueno! Esas sorpresas emocionan,P
Me desperté pendejo nivel 3: No me traje dinero porque iba a traer lunch. Se me olvidó el lunch. Muero de hambre.,N
Putada lv se me jodió la ruedecita del ratón y bueno ,N
"@cuervotinelli @MathiCalfani lo mejor para vos De un fanático ""azulgrana"" (de la UA)Te lo merecés...Sos tan crack que zafaste del clásico",P
"Desperté casi a las 11:00 am. No me juzguen. Tengo el nombre de la princesa que estuvo dormida toda la película, ¿que esperaban?",NEU
Anto te extraño veni a cuidarme,NEU
Típico: Te levantas de noche para ir al baño y corres lo más veloz que puedes para que el fantasma no te alcance,NEU
@gracma hola nena tanto tiempo .como has estado?te cuento ? yo mas feliz no puedo estar hoy,P
lo malo es que faltaba su mid y acabaron haciendo remake ,N
@zophiap vaya manera de despedir este año... pero en otros lugares su bienvenida fue fatal,NEU
"Te extraño como nunca, y no te tengo como siempre.",N
@MateoFernandezE Esperare ese momento desde el Primer capitulo dije qué mateo es el indicado para la anita,P
"Hoy voy a que me hagan pava, pero estoy segura que de nuevo me van a decir ""Nana, NO, su frente es muy pequeña"". La historia de mi vida",N
@AlexXtrecci ya haz algo bueno,N
Yo si que odio recibir noticias así,N
ojala que te de un bloqueo mas grande que el de mi cel,N
Me duelen horrible los pies,N
"Iba a ir a dash pero mis 3 cortadas, mi color de piel (color langosta) y mis 5 horas de sueño en 2 días, no me lo permitieron.",N
"@fabriziobarth lo siento mucho. Pero si Facebook lo dice, es cierto. Sentido pésame...",N
"@CotoLau @AndreCorts yo también tuve los libros de AMP y no me convecieron :/, yo pasé los exámenes pero gracias a los exámenes viejos",NEU
@isachi8 gracias!!!!!! Washis estoy feliz y aprovechando todo lo q puedo gracias por los deseos y buena vibra. Un abrazote a la distancia,P
"Como te elicas algo que no viste venir, ¿Cómo?",NEU
Estoy terminando #GilmoreGirls para estar prontita para el 25 de noviembre...,NEU
"@cuervotinelli Papá estoy muy contento !! , voy hacer el curso de producción televisiva que dictarán @elchatoprada y @hoppefede , besos!!",P
"Momento #emprendedores en el Congreso de los Diputados ahora mismo. Siempre se cita a las startups, no a los innovadores sociales ",N
#ParaElProximoAñoPrometo ser consecuente con la dieta y el treno @Sr_Pelaez @Studio92 @joannabolona,NEU
Tengo un imán para los ADC retrasados ,NEU
Ultimamente estoy comiendo muchos macarrones... gracias Señor @marianorajoy sin ti esto no sería posible ,N
@Se_Wilk @CiutadansCs @PrensaCs @mrhciudadanos @AlfonsoRojoPD Gran capacidad de análisis de @InesArrimadas en esa entrevista. #visión ,P
@CelopanYT @RoEnLaRed estando tan cerca pero tan lejos a 45min de distancia siendo exactos. Jajajaja,P
Ya se que soy lo peor pero jo ,N
@joharoversi ja ja pero está precioso el condenado.,P
"Loco yo desde el sábado estoy pensando en lo divino que es el hermano de Vanesa Britos jajajaja, eu queria uma foto com ele nao com ela",P
@elchatoprada @hoppefede Buen día !!,P
"-Disculpe ¿Qué hora tiene? -Está equivocado señor, esta es una casa de empeño. -Lo sé pendejo, ahí empeñe mi reloj",P
Con un RT podrás ayudar a la asociación de robots con problemas psicomotrices de la Guardia Carmesí https://t.co/ViEV7ST79a,NEU
@DiegoPajaron @miguel_prat doble sub-campeón de Europa  algo es algo jaja,P
"@ProudlyARMY Y que las personas como el están desapareciendo... que los tiernos, dulces y amorosos no se encuentran todos los dias",N
"Por la mañana hazme saber de tu gran amor, porque en ti he puesto mi confianza. Salmos 143:8 Buen día a todos",P
"@KatiaCastorena Que tengas Excelente cobertura y excelente viaje, saludos también al Chicharito",P
@JesusSato27 veo el 50 cosas y me siento un fail porque sos un año más chico que yo y te recibiste de mil carreras Saludos de uruguay.,N
"¿nunca han soñado que estan apuñalando a alguien y al ver que la sangre brota les provoca más clavarle el cuchillo?,¿no?,¿Soy solo yo?",N
prometo ir más al cine y leer muchos libros que tengo pendientes,NEU
A todos se les antojo que les hablara a wpp o snap hoy y tengo que recordarles que mi cel esta roto,N
@eljabavinero @Jonatute Ojalá lo encuentres o que por lo menos lo haya agarrado una familia que le de amor.,P
"Nuevamente fin de semana, cada vez más rápido, ya casi termina el año.!!! Espero que dios le haya dado la mejor de las semana!!!",P
"@dane_ng A Ud. parece que sí, porque la educación que TODO MUNDO recibe por lo visto le choca de sobremanera.",N
Que bueno que este año no me propuse ser más puntual porque hubiera valido verga desde ahorita ya,N
"@cinthiaszc jaja es por un día!!! Pero es el último día del ciclo, mil reuniones con mi área becas y demás.",N
"El año pasado hice un vídeo llamado ""la evolución gráfica de halo"", tal vez haga lo mismo pero con gears of war",NEU
"@JessicaaaFranco yeah! yo lo intente but se veia todo oscuro, luego me dasanimé je...pero estaría bien que todo el fandom lo haga",NEU
"Un poquito de Ministerio del Tiempo y a dormir, que mañana hay que hacer muchas cosas Bona nit",P
@daphnella @goliveros @Tirodopolus las mejores tazitas en la vida yo tengo unos caballitos de tlaque,P
"@victorita_fest Si, justo ese que comi estaba tremendo. Bueno pasame la dir por interno",P
@lux_obrien jajaja enserio? a mi no me anda o bueno creo que no la se usar nose,NEU
súper luna llena significa que la gente va a andar loca por dos semanas a partir de hoy en la mañana. Let the Hunger Games begin!,N
"Me he dado cuenta que soy de emocionarme con cosas pequeñas, si no estuviera en la biblioteca estaría saltando de felicidad #Feliz",NEU
@cayusollo pues necesito un audio para el próximo episodio ¿te animas? ,NEU
"@HolaSoyBataa Pero interrumpiste en mi sueño, perdí el sueño en ese momento y gracias a ti no fui a trabajar porque me quede dormida",N
Mi niña que es tan inteligente me dijo esta mañana por teléfono: mamá que te vaya bien con el huracán. Dos días sin verla,NEU
@Manryev ¡Me alegra muchísimo que te gustara! Igualmente un placer saludarte La próxima que vengás a SJ avisá con tiempo y vamos por café,P
Tio a mi no me dejan viajar sola para ir a firmas ni a conciertos me mato  quiero ir a la de maluma @dios,N
@valk28 haaaaw siempre te voy a abrazar y a ponerte contenta muuuuuuuy contenta!! te quiero mi buhito moradito!!,P
Que me han dicho tantas veces odiosa que a veces creo que si lo soy pero naaah soy un amor,NEU
Super triste que mi amorcito ya este en Pachuca.,N
@PerezJoseAlb @Chelseaboni vamos! Quiero volver para el nuevo año 2018! será genial piénsenlo y me avisan!,P
@leeahistheway ya... ha sido muy grotesco por mi parte poner una foto de Ojeda a las 10:30. Perdona ,N
@Yuremonplsxd @PequeChikane Aquí habemos  me he saturado al leer eso idnwhy,N
"Voy a estar unos días desaparecida, me estoy quedando sin gigas jajajja  q vida + triste !!! Me voy al parque con los perros..",N
@Prifv @kabek no hemos ido a la cabra loca,NEU
No soy una eerta en la cocina pero lo poco que sé siempre me ah funcionado.,P
La verdad hoy fue una noche bastante aburrida espero poder salir mañana,N
Lo mejor de estas fechas es que con el frio vienen los suéters y con ellos solo tengo que planchar el 15% de la camisa... #NavidadGodin,P
"@junchyg16 puede ser pero en mi caso es por q los animales son mas fieles q el ser humano ,no traicionan ,no mienten y no hablan mal",NEU
"Le pedi a un par de amigos que calificaran su año y la mayoría fue 8, el mio está en 7 y pues que mierda pero tratare de tener uno mejor",N
A mi desayuno le hizo falta un alfajor podrida de las galletas de arroz,N
@victorita_fest te hice las caipis ayer y no fuiste,N
@KathyMagliano firme sería muy feo pero losbdos no pueden ganasr,N
@rubialvc @MirthaYudithOF @gizbetan eso fue único jejeje,NEU
@JCesarPL @GuidoBCor Faltaría. Pensaba en cómo se construyen los discursos y quiénes los emplean. Es un debate interesante. ,P
wawwwww siempre encuentro la modelo perfecta amo mi pasion de diseñar #javiercarbajaldiseñador #cdmx #atelierjaviercarbajal,P
Ya me dio nostalgia viendo tantos videos de clásicos antiguos,P
@ElDemonioAzteka prefiero la verdad por más dura que sea y no vivir en el engaño de la mentira !!! Te mando un beso desde Uruguay,NEU
"@efecuadros Yo soy tu sangre mi viejo, yooo, soy tu silencio y tu tiempo. Esta canción la cantaba todos los días de chiquita!",NEU
Si pues; el daño me lo hago yo mismo,NEU
Necesito unos tacones negros a las ya,NEU
"@Tokpelotas @Carlbozal +1 y coincido, no imaginaba que el 4k se notaría tanto a esas distancias. Pensando en pasar a Netflix UHD ",P
"Buenos días!! Si permites que tu corazón sea tu brújula, tu mente sea tu mapa y tu alma sea tu guía, entonces nunca te perderás.. Besitos",P
"@olivares_javier Intentan salvar a Lincoln como Julián con Lorca... Aparte de que es una copia descarada de MdT, no se parecen en nada ",N
Quien no puede dormir y tiene q trabajar temprano,N
@verdesrosas receta médica? Full pepas y descanso,NEU
Que lleguen a hacerte una entrevista la prensa local y yo muerta de sueñito y sin ganas de nada! Ptm.,N
"@arlenemaciel la peor noticia, nos quedamos sin americano en San Diego",N
Tenía más de un año de no usar Premiere Pro y no era tan mala editando... ahora lo olvidé todo,N
Estaba contando que mi mamá tiene como 9 grupos de WA y yo sólo tengo el de mi salón que está silenciado por un año,N
"Hoy le pedí a Dios una señal realmente obvia, para poder tomar una importante decisión, y mas clara no pudo estar. Gracias #Totales",P
"@jc_pblanco ya.. se le va, pero me gustó igual  lo siento, sino.. BLME está bien adaptado o los libros de Sparks ",P
"@_rvng En Castalla (Alicante) muy oportunamente, a primeros de mes celebran sus fiestas de Moros i Cristians i todos están de fiesta! ",P
Porque no soy una persona normal que le guste platicar con personas por whatsaap me conflictua esooo xq xq xq,N
"@vidal_guitar eso es lo angustiante nada de información segura, muchas gracias por responder",NEU
"Odio que mi celular se ponga así Odio tuitear desde la compu, no puedo poner emojis.",N
"Agustín marco mi vida, la cambio por completo y eso no me lo voy a olvidar nunca, GRACIAS",P
"@AngelFabs90 ay, la verdad es que si soy el más feliz del mundo con mis Beats. Junto a los Beats los EarPods y los AirPods son una basura",P
"Vamos @ArvenLoL, dales duro como tú sabes  #LoLHonor2",NEU
"Arreglan todo, y listo, no saben como Sr siente la gente detrás de la pantalla, Camila que paso ?? Yo les tenia fe",N
Lo bueno que mñn acaba sus finales,NEU
"@deibitbanon En el contrato institucional que tengo, 2GB son 9€/mes y 5GB 10€/mes. No había color   Por cierto, acabo de agotarlos O_o",NEU
Ni está tan bonita su novia,N
"@KamilaR94 i told you mi batería es un ridículo, un 10% dura 5 minutos ahora. necesito que arreglen esto ya",N
Me sancocho csm si las van tendrían ventana todo seria mejor,N
"Al final han sido 3h  Bueno, mañana tengo fiesta así que.. No me quejo ",P
"Neta es súper estresante no traer datos, no puedo ver el vídeo y no puedo tuitearte locamente @ElJuanpaZurita #LocurasEnColombiaJZ",N
@meiermq y mejor seria si le en cuentan a un Ramirez.,NEU
"Si papá vas a regalar mi piano, tranquilo que te dejo, no te preocupes ",P
"@Jayah29 ah ta, me pareció por tu twett sobre el petiso que aparentemente no era lo bien dotado que esperabas",N
"@cuervotinelli Buen día Papá hermoso !! ;3, Que tengas un lindo Domingo",P
Que dicha que hay trabajo y salud y vacaciones también,P
"Listo, por fin en casa, a dormir 4 horas nomás. Gracias a Dios mis papás están bien y les está yendo chingón. Ahora yo, a chingarle salu2",P
Votamos por #SiNoEsMuyTarde de #LucianoPereyra @RADIOPOPULARSL Fans Club Oficial Internacional @tuselegidas,NEU
@Aitt7 calla que yo estoy ahora en mi día libre y las horas se pasan más rápido que poniendo copas en el bar ,N
pa kuando la siguiente temporada de Rick y Morty ,N
Como cuando la persona siempre está cansada para todo menos para salir con alguien más.,N
"@cuervotinelli Un horror !! Sin palabras... !!!, hasta cuándo vamos a ser testigos de estas barbaries """"humanas"""", mucha tristeza!!",N
Un ratito a las 10 de la noche con todos bailando y giles haciendo apuestaaas a ver quien se la levanta,N
"@_lauu_20 Gracias por lo de ""ídolo""  Aunque solo soy una persona normal y corriente que escribe libros ",P
"- Amor, ¿vamos a ver la vida secreta de tus muscotas? - Hoy no puedo BB - No tienes dinero no? - No - Misio de mierda.",NEU
"Un señor toca bien bonito, pero apenas traigo para mi pasaje",P
Es el mejor sin duda alguna,P
Se viene algo bueno #Navidad #Imelda #Tronconavideño #Fresas #frambuesas #blueberries @ Imelda,P
"una llegada a Trujillo diferente, meditando pensando y mas tarde a disfrutar la solteria",NEU
"#PierdoMuchoTiempoEn Hacerle caso a los chismes, críticas, malos comentarios hacia mi persona Es mi vida, no la de ustedes",N
"@AxelMishael es una ciudad hermosa llena de cultura,con gente bella y comida deliciosa. Muero por volver! Disfrutá mucho",P
Mis informantes me dicen que a pesar de la tormenta hay 3 fotos que todavía resisten adheridas al barco.,NEU
@DonVascolet los hijos son maravillosos,P
Era yo que le contaba chistes al esco ahora es cadenas,NEU
Final copa libertadores en BAL! la última final de Bradinho... https://t.co/RZnUVPNa5D,NEU
"@juamigcaz es muy responsable y profesional, pero además va muy bien con el estilo de tu club, tiene mucha garra. Un crack!",P
"@cuervotinelli Buen día P@!!, Excelente Jornada de Viernes, TE VEO HOY A LA NOCHE  !!",P
@Exidax no seas tan bueno,NEU
"Espero llegar al work, estoy dms cansada",NEU
"@CarolinaFTAM jo,es que es mortal ",NEU
Las horas que son y sigo sin ser capaz de ponerme a estudiar....el sueño puede conmigo ,N
@eunhyukeeprince por eso yo también tengo mis bias.. y apoyo a los demás pero la mayoría del fandom no y pos..,NEU
@cinencuentro gracias por compartir el teaser amigos de Cienencuentro,NEU
@EduEmoEsc muchas gracias por seguirme. Nos leemos ,P
"Suerte que despierto junto a tí, suerte que senti lo que sentí, Suerte que hay más para conocer Suerte que contigo creceré",NEU
La triste historia de la chica que se durmió sobre sus lentes y ahora los usa chuecos.,N
"Primera reunión del equipo... ""¿Qué Tiene Miguel?"" Pronto!!!! @ Ginebra",NEU
"@AlbertoMoolina sobres, yo llevo los juegos de azar. Tu completa lo demás",NEU
@Rocktor101 consulta virtual o algo en fin Dr. como siempre un gusto saludarle y ya esperándole ... en serio,P
Si se enoja bueno ya no corre mas esa de callarme lo que siento. Estoy re sincera y eso te duele,N
"@cuervotinelli ESTOY MUCHO MÁS FLACO ^_^, toy contento !!, cuánto medís vos Papá??,yo 1.87 descalzo",P
@__el_Negro ah mae que duro eso en este día,N
"@Lupalma12 por favor, mis innumerables tweets a las 3,4,5 de la mañana hablando webadas avalan mi reinado",NEU
"@pabloserrano @JesusBengoechea Madrid tiene la cultura propia de los que ""no tiene cultura propia"". Vamos, como los romanos en su tiempo ",N
"La tierra del olvido es una bonita canción, pero cuando la pienso Iquitos sería la tierra olvidada porque seguimos tantos años hasta las",N
Determinar desde temprano que hoy será un gran día. #BuenViernes al que lee,P
No hay una sola libreta que esté terminando y que tenga que poner el comentario final y no llore. Voy a extrañar demasaido mi clase,N
"estoy entre dos, pero las dos son súper caras ",N
@Jorge68639143 vaaayaaa! Y no necesitó de psicólogo como Gignac,NEU
@Camilo99fuegos y estaban @pepi_goncalvez @valentin_t y la divina @tanilustradacom,P
"Por fin mis amigos me empiezan a visitar en mis destinos de trabajo, solo han tenido que pasar 5 años!!!! (Bueno en Guada tb tuve  )",P
"Primero fue buscando a Nemo, hace un par de semanas a Dory y ahora a un Pokemon Jonny la gente esta muy loca!!!!",N
Querer alguien que no te quiere es como intentar volar con un ala rota. ..................................,N
@Elenacastillo08 Yo tambien y me faltan 2 añales,NEU
@edwin jajajaja con tanta tecnología las pilas salen caras por lo menos te ahorraste en regalos!,NEU
"@AlpioCosta hola, hace mucho q no t veo @arribaarg q pasó? te veía todos los dias desde Uruguay.la verdad q se t extraña chiquilin. volvé",NEU
"Siempre que veo pasar deprisa a una ambulancia de soporte avanzado, se me hace un nudo en la garganta y me vienen malos recuerdos",N
@Pirata__Roberts hay gente muy buena trabajando duro en @SpheraSports. Palabras así impulsan  @Eliperezup,P
"@Sara_G2 jajajaja es súper buen pedo, te va a caer bien. Yo tampoco sé con quién me toca",P
@565Hate @SrTsuki @s0ra_s0 Yo tenía uno de esos son muy buenos... me los robaron en tepito,N
@La_Llama_ @DosPinosOficial tengo que probarlo. Estoy decepcionado. Ahora el fresco leche sabe a puro sirope.,N
"@elgolfo Esta es la segunda vez que los veo y sí, muy pichicatos con los hits, ""NY City Boy"" de mis favoritas y nunca se las he escuchado",NEU
"@FSOGArg @lulopilato @michaelbuble Es muy triste... Yo me enteré el jueves de noche, en Argentina ya se sabía..",N
@UnLocoSuellto te las enviamos por mensaje privado. ¡Saludos!,NEU
@kioskoAMM @gloris72 @olivares1965 @Tomasimedia @madeinLeon Gracias pero los importantes sois vosotros.  Los mediadores.  Sois muy buenos ,P
@Lalusa @moboza @Andrey_Amador errar es d humanos. no debe d pasar a más.,P
@Jullgallo no podes verlo por Vera+..? que horrible verlo sin relato uruguayo!,N
@szerenata toda la suerte del mundo en tu nuevo proyecto /espacio / hora . Te quiero mucho amiga mía . #mty #orgullo,P
"@ErickValdes_ JAJAJAJAJAJA trague puro brócoli y coliflor con pollo ahorita para echarme las tostadas, me las merezco",P
"@Liebehaeschen nop, este crush era nuevo y no había hablado de él aquí para no salarme era muy perfecto para mi peronirogarle",N
@omarvch @plazavea yo hace un momento literal,NEU
@gustragosmaxima deberías poner la de prendido fuego de @ntvgoficial para participar,NEU
@26Manudo @ldacr yo que lo he visto como 10 veces y me lo sé de memoria jejeje lo siento muy emotivo. Ojalá lo vean y lo vean,P
"Y por todos lados hablan de los bloqueos, de ENP, de Trump y pinches es muy deprimente",N
He capturado mi primer gimnasio en el Pokemon Go. Cierto es que es probable que no tarden ni 10 minutos en quitarmelo. Pero mola ,P
"@ToshiHoujo porsupu que me da igual si no uso la consola xdd pero ya pollas, porque la versión que tengo no se puede piratear ahora mismo ",N
Según uno de mis propósitos es leer más pero ya estamos a 8 de Enero y no he comprado ni un libro nuevo,N
"@padremariog Por cierto, para tu trabajo, el alcoholismo no es una opción.",NEU
@MrBeat @SuaraMusic @Brunch_BCN Ni que lo digas. Fue muy triste no poder estar pero mis compañeros lo hicieron de maravilla,N
@ysareth LA delicia! Mi mamá casi no me deja meter a los gatos Pero les encanta dormir aquí cuando pueden,NEU
@Chelo1478 porque si digo que quiero mamón chino me dicen una vulgaridad,N
tu en serio por que sois tan tontos ,N
Ahora adelante va ser diferente y a mi modo ..voy ser muy fria ..hasta q te duela ..y te daras cuenta,NEU
"@mrous_ @carolgvivas La belleza de Tigres presente en todas partes Saludos, chicas!",P
Cada dia extraño mas a Lucas,N
Alba Carrillo como buena modelo haciendo gala de su profesión en la entrevista a Willy Toledo  #HableConEllas,P
@CoupleLuxury no las des preciosa ,P
"Buenas noches papus, que descansen",P
El 2017 lleva nueve días y ya tengo el celular y el corazón rotos #FML,N
@Rumbo chicos... estais por aqui???? tengo un problemilla,N
"@CCRUZ305 y en Chile hubo terremoto de 7,7. El 2016 es el peor año.",N
Casi me quedo dormido en el bus hasta Trujillo,NEU
"Pensé hacer algo con Belén y machu, pero de nuevo me dejaron sola",N
"Me voy a las 6 a Madrid y me esperan 6 horitas en un autobus, seguramnete lleno de gente, porque mi suerte funciona así ",N
@HYZAK Y nosotros listos para tenerte de vuelta Kany!,P
Gracias todos los que me dejaron un mensaje diciéndome suerte,P
@kzfabi vivís de joda .. y siempre donde vas hay cerveza... no necesitamos ML ni IA para acertar eso ehh @FabianImaz @pp_uy,NEU
Era más fácil ir hasta el cuartito de utileria y traer una red nueva,N
Ahora que empiezan las jornadas de toros en esta ciudad me pongo un poco más triste al ver que seguimos sin evolucionar en muchas cosas ,N
@taliferreto jaja pero con el pasar del tiempo no se va a ver feo,NEU
@alevar13 me la pasas? Mi playlist feliz necesita actualización,NEU
@Kev_Rogers mándale fueguito a @abeftlouis está muy enferma,N
"@tuiteroboutique Ja, ja, a mí me pasó lo mismo la primera vez que me enteré... entre pato (duck) y ducto (duct) no hay mucha diferencia",NEU
"Y en el café sonó ""Son Inú"". Y hasta los que estábamos sentados, nos meneamos",P
@Yeesus_ @laMaquinaPeru @CSerranoTV ya no es lo mismo,N
"Primer vez en años que no tengo plan de Halloween, difraz, nada... solo quiero terminar de estudiar rápido y ver el partido",NEU
"@Jorge_Rivera8 la del mio peor, tengo que andar con dos telefonoa para poder revisar tw, fb e ig",N
Hoy es el último taller de año,NEU
@_aliciagonzg uf es que es muy emo ,NEU
Creo que alguien me ha bloqueado. Es una sensación rara porque empezaba a tenerle cariño a esa persona y no lo entiendo. Me siento mal ,N
"Lo de quedarse sola en casa sonaba a planazo de domingo, hasta que me doy cuenta de que no hay dulces en casa ",N
"@juanlebrijo Esa posibilidad está contemplada y, si hiciera falta, x el bien de España y por responsabilidad volvería a hacerse sin dudar ",NEU
"Pero es que La Sirenita soy Incapaz de encontrarla así, la encuentras o en latino latino, o en castellano. Y a mí me gusta esta ",N
@AlbertoVill descubri que soy celosa,N
